{
  "attributeSet": "id minim ipsum enim nisi",
  "id": null,
  "translatedName": "quis consequat",
  "auditInfo": {
    "isDeleted": null,
    "createdBy": "dolor",
    "updatedBy": "adipisicing Lorem",
    "updatedDate": "1978-08-07T17:37:11.571Z",
    "createdDate": "2005-02-26T01:31:57.369Z"
  }
}
